问题,选项1,选项2,选项3,选项4,答案
以下哪句话中“苟且”的意思(或用法)与其他句子不同。,革命烈士们宁愿英勇牺牲也绝不苟且偷生。,我们不能苟且偷安，一定要自强不息，才能创出一番事。,他做翻译，一字一句都不敢苟且。,年青人不应苟且偷安。,C
以下哪句话中“板”的意思(或用法)与其他句子不同。,拍板常与板鼓合用，由鼓手兼操。,在闽南文化南音中，拍板是一种重要的乐器。,拍板是一种打击乐器,这是一片木板。,D
以下哪句话中“中学”的意思(或用法)与其他句子不同。,中学教育在塑造青少年的品德、知识和技能方面起着重要的作用。,曾纪泽、张自牧、郑观应、陈炽、薛福成等大抵讲“中学为体，西学为用”的人，无不持“西学中源”说。,中学是为了培养青少年的综合素质而设立的教育机构。,我们的学校是一所提供中学教育的优秀学校，致力于为学生提供高质量的教育和培养。,B
以下哪句话中“黑暗”的意思(或用法)与其他句子不同。,电灯给黑暗的屋子带来了光亮。,黑暗即将过去，曙光就在前头。,太阳落下去了，树林里一片黑暗。,在黑暗的旧社会，劳动人民过着痛苦的生活。,D
以下哪句话中“宽大”的意思(或用法)与其他句子不同。,你犯了罪就要彻底交代，争取宽大处理。,这是一件宽大的睡袍。,他决心老老实实交代自己所犯的罪行，改邪归正，争取得到政府的宽大处理。,公安人员劝他打消顾虑，揭发同伙，争取宽大处理。,B
以下哪句话中“脱落”的意思(或用法)与其他句子不同。,门上的油漆已经脱落了。,毛发脱落。,牙齿脱落。,文字脱落。,D
以下哪句话中“插花”的意思(或用法)与其他句子不同。,我喜欢用插花的技巧将各种美丽的花朵巧妙地搭配在一起，插进花瓶中供观赏。,干部也插花编在各组内。,通过插花的技巧，我将各种色彩鲜艳的花朵有序地插进花瓶，创造出一个令人愉悦的观赏花束。,插花艺术可以通过将不同种类的花朵巧妙地搭配在一起，使花瓶更加美丽和吸引人。,B
以下哪句话中“万般”的意思(或用法)与其他句子不同。,元宵节这一天，河上有万般的花灯。,经过这次亲人的离世，我万般痛苦。,我感到万般快慰,当我观看这部纪录片，我感到世界万般神奇。,A
以下哪句话中“由来”的意思(或用法)与其他句子不同。,这个事件的由来是什么。,查清这件事的由来。,由来已久。,查清这次火警的由来。,C
以下哪句话中“周章”的意思(或用法)与其他句子不同。,他大费周章的将她救出来。,大费周章。,金化为水，水性周章。,煞费周章。,C
以下哪句话中“归真”的意思(或用法)与其他句子不同。,简单生活引领时尚，回归自然返璞归真。,莹然摩尼，归真於土。,人生最低的境界是平凡，其次是超凡脱俗，最高是返璞归真的平凡。,她脱下舞裙，归真返璞，相夫教子，得到了家人谅解。,B
以下哪句话中“拐弯”的意思(或用法)与其他句子不同。,我是一个直性子的人，说话从不拐弯抹角、旁敲侧击。,这条山路拐弯抹角的，难走极了。,这种每次都拐弯抹角、指桑骂槐的邻居，谁受得了？,有什么话你就直说，不必拐弯抹角。,B
以下哪句话中“倒运”的意思(或用法)与其他句子不同。,余家兄弟两个越发呆串了皮了，做出这样倒运的事。,她是个倒运鬼，我每次碰见她都要输钱的。,他们一伙最近又靠倒运木料赚了一大笔钱。,谁也不想发作这些倒运透顶的事。,C
以下哪句话中“中堂”的意思(或用法)与其他句子不同。,我们都在中堂坐着。,中堂高高挂在墙上。,我们一会儿在中堂吃饭。,中堂在哪里。,B
以下哪句话中“过时”的意思(或用法)与其他句子不同。,你再不来，过时不候。,这种款式已经过时了。,他戴着一顶过时的毡帽。,学校宣布废除一些过时的规章制度。,A
以下哪句话中“挽”的意思(或用法)与其他句子不同。,转粟挽输以为之备。,一个很小的偏差，就有可能造成无法挽回的损失。,小兵刚上场就进了一球，挽回了我们班被动的局面。,在比赛的危急时刻，小兵力挽狂澜，取得了最终胜利。,A
以下哪句话中“生猛”的意思(或用法)与其他句子不同。,一只半尺长的蟑螂长得很是生猛,马的矫健生猛，灵活雄骏，如江湖好汉,那时还不时兴生猛海鲜地海吃海喝，,今天看到一个神魔弃子居然如此生猛，,C
以下哪句话中“榨取”的意思(或用法)与其他句子不同。,榨取民财。,他榨取他的佃户。,榨取人力。,榨取汁液,D
以下哪句话中“推展”的意思(或用法)与其他句子不同。,商场举办羊绒精品推展活动。,由此可见，蒋经国推展本土化政策，只是台人治台策略的运用，而李登辉则将本土化作为一种战略。,在他执政后所推展的本土化政策与蒋经国存有明显的差异。,李登辉推展本土化的结果是使台湾政坛政出多门，一片混乱，“台独”势力猖獗。,A
以下哪句话中“珠玑”的意思(或用法)与其他句子不同。,出嫁那天，她的脖子上挂满了珠玑,他常常口吐珠玑，有不凡之论。,满腹珠玑。,万字珠玑。,A
以下哪句话中“确信”的意思(或用法)与其他句子不同。,我确信我的答案是正确的。,我确信我们是对的。,不管事成与否，请给我一个确信。,我们确信这一崇高理想一定能实现,C
以下哪句话中“上上”的意思(或用法)与其他句子不同。,说到房子的优劣，何谓优，何谓劣？没人搅扰就是上上。,我希望求得一个上上签。,上上星期你说过要陪我出去看电影的。,只有这样才是上上策。,C
以下哪句话中“苍黄”的意思(或用法)与其他句子不同。,郎中看他面色苍黄摇了摇头,多年的劳作造就了他苍黄的皮肤,母亲神色苍黄地跑向车祸中的儿子。,那片苍黄的沙漠就是他的故乡,C
以下哪句话中“优柔”的意思(或用法)与其他句子不同。,它是一个优柔的人，遇到什么问题都想很多,他做事总是很优柔，总会让人很急,优柔的性格不利于办大事,优柔温润,D
以下哪句话中“月例”的意思(或用法)与其他句子不同。,今天该发月例了。,女生每个月都会来一次月例。,月例银子。,今年月例是多少。,B
以下哪句话中“农家”的意思(或用法)与其他句子不同。,她从小在农家长大，对农田和农作物非常熟悉，对农业有着深厚的理解。,先秦时期反映农业生产和农民思想的学术派别称为农家。,这个地方是一个典型的农家村庄，居民以务农为生，过着简朴而安宁的生活,农家的饭菜总是新鲜又美味，因为他们使用的是自家种植的有机食材。,B
以下哪句话中“名优”的意思(或用法)与其他句子不同。,这部电影中的主角是一位影视界的名优，凭借出色的演技赢得了观众的赞赏,这个舞蹈团队拥有一批优秀的舞蹈演员，他们被誉为舞蹈界的名优。,这个音乐学院培养出了很多音乐界的名优，他们在国际舞台上展现出卓越的才华。,这是青岛名优产品。,D
以下哪句话中“化装”的意思(或用法)与其他句子不同。,杨子荣化装成土匪侦察敌情。,还有些同志化装成难民、商人、小贩，跑到上海南京去，收买破机器。,舞台后面，演员们正在化装准备上场。,为了侦察敌情，他化装成商人进城去了,C
以下哪句话中“杂烩”的意思(或用法)与其他句子不同。,我喜欢吃大杂烩。,杂烩味道如何？,有谁会做大杂烩吗？,杂烩混杂的收集物。,D
以下哪句话中“嘴刁”的意思(或用法)与其他句子不同。,我嘴刁，我想吃我喜欢的。,他嘴刁，太难伺候了。,这小鬼嘴刁，差点儿被骗了。,他从小就嘴刁，什么都不吃。,C
以下哪句话中“点子”的意思(或用法)与其他句子不同。,我们需要一些新的点子来创新我们的产品,在头脑风暴会议中，大家纷纷贡献自己的点子。,我的衣服上溅上了几滴油点子,他总是能够迅速提出独特的点子解决问题,C
以下哪句话中“相机”的意思(或用法)与其他句子不同。,同时，军区大院南门外的胜利路两端也各放了一个连，准备相机行事。,可是我等了你两天你也没出来，我刚把相机放回去你就出来了！,照相要取好景物的范围，选好照相的位置及照相机的光圈和拍摄的速度等。,目前使用扫描仪、数码摄像机和数码照相机作为图片和影像输入的也越来越多。,A
以下哪句话中“划分”的意思(或用法)与其他句子不同。,在划分文章段落层次时，我对承上启下的语句的位置总是划不到位。,划分人民内部矛盾和敌我矛盾。,双方激烈地辩论着如何划分词类范围的问题。,老师给各个小组都划分好了卫生区,B
以下哪句话中“红领巾”的意思(或用法)与其他句子不同。,鲜艳的红领巾在少先队员的胸前飘动着。,红领巾代表着少年先锋队员。,回想我刚戴上红领巾的时候，多么自豪！,升国旗的时候，少先队员要佩带红领巾。,B
以下哪句话中“贯通”的意思(或用法)与其他句子不同。,一篇好的文章应该前后贯通，条理分明。,洞中泉流跟冰壶、双龙上下相贯通。,他把学习和实践融会贯通了。,在学习中要学会融会贯通，不要只是生吞活剥一些知识。,B
