问题,选项1,选项2,选项3,选项4,答案
以下哪句话中“热线”的意思(或用法)与其他句子不同。,这个工厂把红热线加到技术当中。,热线联系。,热线服务。,点播热线,A
以下哪句话中“对眼”的意思(或用法)与其他句子不同。,在对眼的检查中，医生发现了一些问题，并提供了相应的治疗建议。,几件衣服看着都不对眼,医生建议她要注意用眼卫生，以防止对眼产生过度疲劳。,她戴上眼镜后，终于可以清晰地对眼看字了。,B
以下哪句话中“转行”的意思(或用法)与其他句子不同。,甲乙戊庚，随时转行，不失常节。,他要转行做演员。,他转行餐饮业。,他转行服务业。,A
以下哪句话中“有毒”的意思(或用法)与其他句子不同。,你有毒吧，怎么你一来鸽子全都飞了。,你才来三天就把我电脑搞坏了，你有毒吧。,你来广东三次，三次都刚好下雨，你有毒吧。,君其无谓邾小，??有毒，而况国乎？,D
以下哪句话中“合并”的意思(或用法)与其他句子不同。,人欲天不违，何惧不合并。,两个学校合并之后，已不分畛域。,思想品德和社会两个学科合并成一个学科。,那两所学校已经合并一年多了。,A
以下哪句话中“过心”的意思(或用法)与其他句子不同。,咱俩是过心的朋友，有什么话不能说？,与过心的朋友总是无话不说。,我直话直说，你别过心。,一生中能遇到过心的人很幸运。,C
以下哪句话中“管界”的意思(或用法)与其他句子不同。,另外，介绍本文研究的基本思路、方法，以及管界研究的意义。,管界就是管辖地区的边界。,他说和建筑界，导演界，商业主管界的领头羊人物工作之后，他认识到他们有一个共同点。,在英语篇章分析中，不同的管领词所修饰或通领的管界的范围和位置不尽相同。,B
以下哪句话中“花里胡哨”的意思(或用法)与其他句子不同。,别听他花里胡哨的那一套。,她穿得花里胡哨的。,严禁花里胡哨，浮夸虚报，成绩是成绩，不足就是不足。,这个人做事花里胡哨的，不适合干财务工作。,B
以下哪句话中“不测”的意思(或用法)与其他句子不同。,他拿了一根大棒子以防不测。,其为物不贰，则其生物不测。,我担心他是不是有什么不测了。,我们必须筹措一笔储备基金以应不测。,B
以下哪句话中“嚷嚷”的意思(或用法)与其他句子不同。,这事嚷嚷出去，对谁都不好。,别嚷嚷，安静点。,再嚷嚷我就生气了。,别嚷嚷，人家还在休息。,A
以下哪句话中“呼唤”的意思(或用法)与其他句子不同。,清晨，草地里昆虫家族的成员们轻轻呼唤，互相应答。,我忽然想起来了，大哥往常就是这样呼唤羊群的。,早晨，妈妈轻轻地呼唤着我的名字，叫我起床。,这种事情呼唤下人去做就好了。,D
以下哪句话中“命题”的意思(或用法)与其他句子不同。,命题：二等分一直线。,对于任何应用程序，安全是一个困难但必要的命题。,我看四十四年来的作文命题，大部分都适合装疯卖傻。,办学特色是各高等学校的一个重要命题。,A
以下哪句话中“公判”的意思(或用法)与其他句子不同。,今天召开万人公判大会，判处罪恶滔天的，那个外号叫“南霸天”的人死刑，立即执行。,上级指示拿下白河据点后一起举行公判大会。,请求公判。,广东生产建设兵团四师团的一块空地上，举行了一次万人参加的公判大会。,C
以下哪句话中“海况”的意思(或用法)与其他句子不同。,掌握技能需要的经验在不同风速和海况，以及知识的帆船。,这种运送将高速进行，并将在各种海况和地形情况下将装备投放到海滩上。,海况表上记录着各种数据。,同一海况下，海面波动的时间过程和沿主波向的空间分布是明显不同的。,C
以下哪句话中“有意”的意思(或用法)与其他句子不同。,他是有意的，不是无心的。,他有意想要让我失败,他这是有意跟我作对。,小王对小杨有意，可一直没机会表白。,D
以下哪句话中“旋子”的意思(或用法)与其他句子不同。,伊正向海上看，只见几座山奔流过来，一面又在波浪堆里打旋子。,快拿旋子烫滚水，你且坐下。,蝙蝠见了火光惊飞起来，打了几个旋子，消失在黑暗中。,有一回我已经十多岁了，和几个孩子比赛打旋子，看谁旋得多。,B
以下哪句话中“中人”的意思(或用法)与其他句子不同。,她的方方面面都处于中人。,她的身材中人以上。,我有中人，可以为我作证。,她的相貌不及中人。,C
以下哪句话中“扫除”的意思(或用法)与其他句子不同。,今天我们来大扫除。,这块区域我们负责扫除。,室内室外要天天扫除。,国家致力于扫除文盲。,D
以下哪句话中“搬砖”的意思(或用法)与其他句子不同。,美好的假期结束了，收拾心情，努力搬砖。,穿了加绒的裤子和毛衣坐在办公室里感受到了踏实，努力搬砖中。,他在建筑工地上搬砖已经工作了五年。,人生没有四季，只有两季，努力就是旺季，不努力就是淡季！新的一天，继续搬砖。,C
以下哪句话中“永生”的意思(或用法)与其他句子不同。,永生难忘。,真善美是他永生的追求。,精神自由是我永生的追求。,未争取民族解放而牺牲的烈士们永生。,D
以下哪句话中“滋味”的意思(或用法)与其他句子不同。,挨饿的滋味不好受。,菜的滋味不错。,心里真不是滋味。,被骂的滋味怎么样。,B
以下哪句话中“红色”的意思(或用法)与其他句子不同。,红色根据地是我党最安全的地方。,妹妹这身红色的衣服在雪地里十分抢眼。,这条红色的手链是小霞送给我的友谊的纪念。,橙红色的太阳带着对天空的最后一丝倦恋，慢慢没入海中。,A
以下哪句话中“冠冕”的意思(或用法)与其他句子不同。,每次迟到，他总是会找些冠冕堂皇的理由。,这个讲题虽是冠冕堂皇，可是其论点和论据却只是皮相之谈。,谁都知道他在私底下做了哪些坏事，但表面上偏要说得冠冕堂皇。,古代帝王戴的帽子叫做冠冕。,D
以下哪句话中“糟蹋”的意思(或用法)与其他句子不同。,这阵大风糟蹋了不少果子。,她被糟蹋了。,小心剪裁，别把料子糟蹋了。,不要糟蹋了这么好的果子。,B
以下哪句话中“孤立”的意思(或用法)与其他句子不同。,江心有一个孤立的小岛。,他孤立无亲，危弱无辅。,一座孤立的桥墩。,孤立的建筑物。,B
以下哪句话中“入伙”的意思(或用法)与其他句子不同。,来信内容是劝俺入伙，并说如俺入了他们的“中性人联谊会”，宫中漂亮的男的女的由俺挑选,饭已经做好了，可以入伙吃饭了。,最近，你的几位老同学希望你能入伙，和他们共办一家软件公司。,新入伙的住户可到管业处办领登入名称和密码。,B
以下哪句话中“印子”的意思(或用法)与其他句子不同。,车轮印子。,这有野兽的脚印子。,这得给您打印子，利息几分？,地板上踩了好多印子。,C
以下哪句话中“秋景”的意思(或用法)与其他句子不同。,今年秋景不错。,今年秋景好于去年。,香山秋景。,秋景好了，农民也就开心了。,C
以下哪句话中“笨头笨脑”的意思(或用法)与其他句子不同。,皮鞋做得笨头笨脑的，我不喜欢。,这个人笨头笨脑真没意思。,老师总是说他笨头笨脑，弄得他越来越不自信了,他从不和笨头笨脑的人打交道。,A
以下哪句话中“荒废”的意思(或用法)与其他句子不同。,他小时候由于贪玩而把学业荒废了，现在后悔莫及。,老师训诫我们千万不要荒废学业。,村里没有一亩荒废的土地。,因为在外打工挣钱，他的学业已荒废了,C
以下哪句话中“甩锅”的意思(或用法)与其他句子不同。,印度小哥炒菜时表演甩锅神技，观众看的是目瞪口呆,萌娃痴迷甩锅颠勺，姿势动作十分专业。,美国一些政客为了选举，将党派利益置于国家利益之上，将抗疫问题政治化，一门心思对外“甩锅”推责,5岁男孩凭花样“甩锅”走红网络，熟练颠勺的样子像极了大厨。,C
以下哪句话中“科考”的意思(或用法)与其他句子不同。,“学而优则仕”，在科举时代，是指知识分子在科考中成绩卓异，才能求得一宫半职。,科考船已经准备就绪，随时可以出发进行海底地质的科考工作。,他是一名经验丰富的科考人员，参与过多次海洋科考任务。,这个科考团队将前往南极进行一次重要的科学考察。,A
以下哪句话中“关照”的意思(或用法)与其他句子不同。,请你关照司机一声，叫他在会场门口等我。,我走后，小丽就请你多多关照。,洽谈中请您多多关照。,把这点东西送给您，聊表寸心，感谢多年来对我的关照。,A
以下哪句话中“左翼”的意思(或用法)与其他句子不同。,左翼先前进。,左翼分子。,左翼听令匍匐前进。,让左翼去突击敌人。,B
以下哪句话中“功力”的意思(或用法)与其他句子不同。,功力未见于国者，则不可授以重禄。,这两位名家的作品功力悉敌，各有所长。,从这幅字可以看出爷爷在书法上的深厚功力。,这个故事不仅内容吸引人，尤其说书者的功力深厚，使我没等听完，就忍不住拍案叫绝。,A
以下哪句话中“驼峰”的意思(或用法)与其他句子不同。,动车要到驼峰了。,骆驼的驼峰储藏了大量的脂肪。,骆驼背上突起的地方叫驼峰。,骆驼的驼峰可供身体消耗。,A
以下哪句话中“环节”的意思(或用法)与其他句子不同。,禾虫在动物学上属于环节动物多毛类。,这是钻研教材、语文备课重要的环节。,否定是事物发展的一个环节。,这两个环节相辅相成，缺一不可。,A
以下哪句话中“原来”的意思(或用法)与其他句子不同。,我还疑惑怎么给我打招呼呢，原来是我的高中同学。,我说在，怎么这么冷，原来是下雪了。,现在的日子比原来好多了。,原来是你。,C
以下哪句话中“撤回”的意思(或用法)与其他句子不同。,即可商令各国将在中国所设之邮局撤回。,他撤回刚刚说的话。,太祖从之，命先锋李继勋屯兵上党；又遣人撤回何继筠等。,天启二年九月(二十九日)壬戌，汪崇孝大言不惭，御众无法。该抚(袁可立)称盐院已将本弁撤回。,B
以下哪句话中“固定”的意思(或用法)与其他句子不同。,把聘任制固定下来。,我们上课一直没有固定的教室，今天在这儿，明天在那儿。,他没有固定工作，全靠零敲碎打地帮人干活挣点钱养活母亲。,如今兄弟四海为家，并无固定住所。,A
以下哪句话中“软绵绵”的意思(或用法)与其他句子不同。,病虽好了，身子还是软绵绵的。,妈妈织的围巾软绵绵的。,鞋底软绵绵的，穿起来特别舒服。,她的脸软绵绵的。,A
以下哪句话中“安心”的意思(或用法)与其他句子不同。,他这是什么安心,这个人安心叵测,小心他别有安心,你就安心养胎吧,D
以下哪句话中“什件儿”的意思(或用法)与其他句子不同。,我喜欢吃什件儿。,抄什件儿。,黄铜什件儿。,什件儿味道怎么样？,C
以下哪句话中“主干”的意思(或用法)与其他句子不同。,主干教师。,主干队伍。,植物主干。,他是我们队伍中的主干。,C
以下哪句话中“病害”的意思(或用法)与其他句子不同。,这种病害已经感染了整个农田。,这个花园里的花卉受到了真菌病害的影响。,这些病人被病害所折磨。,这些植物由于受到病害的侵袭而枯萎。,C
以下哪句话中“鬼脸”的意思(或用法)与其他句子不同。,对烦恼做个鬼脸，把它吓跑；把忧愁绑在靶心，甩手飞镖。,年轻的时候，我们常常冲着镜子做鬼脸。,总会仙倡，戏豹舞熊。白虎鼓瑟，苍龙吹笙。注曰：皆为假头也。假作其形，即今鬼脸儿。,爸爸连赢三局，他可神气了，给我扮了个“哭”的鬼脸。,C
以下哪句话中“刮鼻子”的意思(或用法)与其他句子不同。,第一个游戏名叫“破冰行动”，可是，抢答、刮鼻子、自我介绍、介绍邻座这样的举动，让这些原本十分内向的孩子一时无法适从。,这个大哥棋瘾大，臭棋篓子，输了，就老老实实让大家刮鼻子，从此就没人怕他了。,他让连长刮鼻子了。,她说每人摸13张，我说好，那也得有个奖惩分明，我提议刮鼻子。,C
以下哪句话中“摆平”的意思(或用法)与其他句子不同。,谢谢你替我摆平这次困难,他轻而易举就摆平这件事了,我替你摆平他。,生了二胎要摆平心态对待大的和小的。,D
以下哪句话中“巅峰”的意思(或用法)与其他句子不同。,我们终于爬上了泰山的巅峰。,此次演唱会让他的演艺生涯又达到巅峰。,他的事业正值巅峰状态，却不幸为一场车祸夺去性命。,能力让你走上巅峰，但品质才能你在上面站稳脚跟。,A
以下哪句话中“戏”的意思(或用法)与其他句子不同。,这部戏剧情跌宕起伏。,这出戏剧导演编置有序，很受人们喜爱。,今晚的戏剧已经开场了。,今天天气分外的好，公园里好多小朋友在嬉戏玩耍。,D
以下哪句话中“终年”的意思(或用法)与其他句子不同。,他终年都在玩。,终年八十岁。,这是一座终年积雪的高山。,他终年都无所事事。,B
以下哪句话中“衡量”的意思(或用法)与其他句子不同。,考试可以衡量你平时的学习情况。,时间往往是衡量人心的试金石。,这场灾难所造成的损失是无法用金钱来衡量的。,惟衡量之器耳。,D
以下哪句话中“从容”的意思(或用法)与其他句子不同。,人生有大起大落，也会有大喜大悲，这是必经之事，都要学会从容以对，才能暖笑无殇。从容是什么？从容是遇事不惊慌，积极乐观地面对所有，从容是对人不计较,你尽可慢慢看报，时间还很从容。,从容者大度，所以不急不躁；悠闲者达观，所以不温不火。,一个人的生活，不惊不扰，从容以待。,B
以下哪句话中“回归”的意思(或用法)与其他句子不同。,中央电视台举办大型歌舞晚会，庆祝香港回归祖国。,为了迎接澳门回归，市里组织青年进行环城长跑比赛。,实现台湾回归祖国，完成祖国统一的大业。,如果统计回归导致实验结果上的错觉，则称之为回归假象。,D
以下哪句话中“关闭”的意思(或用法)与其他句子不同。,商场关闭的话，会给周围的人带来很多的不便。,这家工厂因缺少资金而关闭了。,每关闭一所学校，就得多造一座监狱。,上帝在关闭一扇门的同时，一定会为你打开另一扇门。,D
以下哪句话中“黄油”的意思(或用法)与其他句子不同。,冬季饮食切记：吃面包，要拒绝黄油,你发现，如果一个人只靠面包和黄油度日，即使一周，也不再有人样了，仅仅是长有几个附属器官的胃而已。,黄油是一种润滑油。,在碗把黄油和红糖和白糖搅拌直到平稳和乳脂状。,C
以下哪句话中“中流”的意思(或用法)与其他句子不同。,中流砥柱。,居于社会中流。,击楫中流，泱泱大风。,船在中流飞速的穿行。,B
以下哪句话中“声带”的意思(或用法)与其他句子不同。,他的声带发出的声音好好听。,他的声带很独特。,我要去买一块声带。,我的声带受损了。,C
以下哪句话中“正方”的意思(或用法)与其他句子不同。,学生们在几何课上学习如何计算正方形和立方体的表面积和体积。,正方形的四条边长度相等，每个角都是90度。,正方：我方认为现代信息交流方式会增进人与人之间的理解。,这个盒子是一个立方体，有六个面，每个面都是正方形。,C
以下哪句话中“消耗”的意思(或用法)与其他句子不同。,他离家多年。杳无消耗。,将这些能量加在一起，那么一昼夜的能量消耗为2400-2500千卡。,第三部门在为社会公益事业奉献的同时要消耗各种资源，需要人力、物力、财力的投入。,如果倒算一下所要消耗的原材料的话，已经远远超出了目前全球这种原材料的供应量。,A
以下哪句话中“扫射”的意思(或用法)与其他句子不同。,吴荪甫走前一步，威严的眼光在屋子里扫射，最后落在阿萱的身上。,他在敌人疯狂的扫射下死里逃生。,敌人发现了他们，机枪拼命向这边扫射。,上岸的三个人当中，有两个在机枪扫射下直挺挺跌了下去。,A
以下哪句话中“上路”的意思(或用法)与其他句子不同。,明天我们就上路。,只要你点头我们马上动身上路。,午时三刻时辰已到，送强盗们上路。,你准备一下，我们就要出发上路了。,C
以下哪句话中“作呕”的意思(或用法)与其他句子不同。,太难吃了，他作呕了。,我的眼儿流泪，我的心儿作呕。,太恶心了，想作呕。,什么味道，好想作呕。,B
以下哪句话中“烘托”的意思(或用法)与其他句子不同。,烘托是国画的一种画法。,侧面烘托，换个角度说也就是虚写。,这篇小说用环境描写烘托悲壮的场面。,这一段描写烘托出主人公内心充满野心和欲望的复杂心情。,A
以下哪句话中“过节”的意思(或用法)与其他句子不同。,旧社会，老百姓每到过节之时，都忙里偷闲，苦中作乐。,爸爸公司的待遇很好，逢年过节都会发放礼品。,爸爸平常不喝酒，只在过年过节时才喝一点。,慢者过节，急者流荡。,D
以下哪句话中“摇手”的意思(或用法)与其他句子不同。,我用摇手将自行车的轮子转动起来，开始了愉快的骑行之旅。,我试图劝说他改变主意，但他只是用摇手表达他的坚定立场。,当我提出反对意见时，他用摇手示意我停止说话。,在会议上，他用摇手表示不同意我的提议。,A
以下哪句话中“驱使”的意思(或用法)与其他句子不同。,被仇恨所驱使。,被好奇心所驱使。,私欲无情地驱使着他。,不堪驱使。,D
以下哪句话中“透析”的意思(或用法)与其他句子不同。,肌酐清除率小于5ml/min者，不能使用本品，除非病人在48小时内进行血液透析。,将失败的例子透析给读者，知其然，亦究其所以然，使读者避开梦想中的陷阱，更加接近成功。,血液透析可去除30～40%的他唑巴坦/哌拉西林，另外5%的他唑巴坦以代谢物被透析去除。,本品使用过量在机体组织中的浓度与毒理的关系不详。血液透析或腹膜透析可清除本品。,B
以下哪句话中“栽培”的意思(或用法)与其他句子不同。,栽培水稻。,栽培蔬菜。,栽培果树。,感谢老师的栽培。,D
以下哪句话中“强项”的意思(或用法)与其他句子不同。,他的强项不过就是平白老套的基础工作，情报交易，勤勉努力以及对敌人的洞若观火。,短跑是小明的强项，学校运动会是他大显身手的时候。,千万不要有侥幸心理，认为自己的强项一定能弥补弱项，高考什么都能发生，有弱项会使你未战先败！,一语道尽爱情的残忍。情到深处人孤。疾苦使人成熟，强项的人会感悟爱的真谛，而懦弱的人徒生怅恨。,D
以下哪句话中“指南针”的意思(或用法)与其他句子不同。,去野外没有指南针容易迷路。,去野外需要备一个指南针。,心里要有一个生活的指南针。,哪里可以买到指南针。,C
以下哪句话中“拐弯抹角”的意思(或用法)与其他句子不同。,我不习惯听人说话拐弯抹角，您就开门见山说明来意吧！,他说话老是拐弯抹角。,表哥平时说话直言不讳，从不拐弯抹角。,这条路弯来弯去拐弯抹角的，太难走了。,D
以下哪句话中“规格”的意思(或用法)与其他句子不同。,商品的规格与说明书上介绍的不太一致。,如果产品不符合规格，就不能出厂。,接待来宾的规格很高。,当初我说过要一等品。所以合同里将质量、规格和价钱都写的很明确。你还记得吗？,C
以下哪句话中“敲黑板”的意思(或用法)与其他句子不同。,对于这个商品，博主疯狂对我们敲黑板。,老师一边写字，一边敲黑板。,老师故意用粉笔敲敲黑板，以引起大家的注意。,老师敲了敲黑板以引起我们的注意。,A
以下哪句话中“推翻”的意思(或用法)与其他句子不同。,推翻原有结论。,推翻强加给他的污蔑不实之词。,推翻反动统治。,推翻他的说辞。,C
以下哪句话中“合力”的意思(或用法)与其他句子不同。,只要教师和家长协调一致，才能形成教育的合力。,引力和离心力的合力称为重力。,团结就是力量，团结就会形成合力、产生凝聚力。,卓越源于责任，责任涵盖管理，重复产生合力。,B
以下哪句话中“荒漠”的意思(或用法)与其他句子不同。,那种令人迷惑的荒漠气氛意味深长地笼罩着这群岛屿,如果不珍惜水资源，地球就会变成一片荒漠。,美丽的草原遭到了风沙的蚕食，正在逐渐变成荒漠。,曾几何时这里还是丰茂的草原，现在却变成了荒漠。,A
以下哪句话中“破防”的意思(或用法)与其他句子不同。,她说的话让我破防,他超级容易破防，十分脆弱,在别人咄咄逼人的攻势下，她破防了,敌方士兵成功破防，闯入了我方阵地。,D
以下哪句话中“和气”的意思(或用法)与其他句子不同。,孔窍虚，则和气日入。,他对任何人都是一团和气。,为人要和气，不要轻易和别人发生口角。,她待人和气，脸上总是带着微笑。,A
以下哪句话中“好几”的意思(或用法)与其他句子不同。,这个案子，涉及到好几个高级干部。,李奶奶热心于慈善事业，收养了好几个孤儿。,他已经三十好几了。,妈妈真能耐，一个人管好几台织布机。,C
以下哪句话中“专诚”的意思(或用法)与其他句子不同。,他对爱情那样专诚。,我是专诚来道谢的。,我是专诚来跟你说声抱歉的。,专诚拜访。,A
以下哪句话中“主攻”的意思(或用法)与其他句子不同。,指战员纷纷请战，要求担负主攻任务。,他选了梵文做他的学习主攻方向。,主攻丑角。,主攻力学。,A
以下哪句话中“乖乖”的意思(或用法)与其他句子不同。,乖乖是妈妈对女儿的爱称。,敌人被我军包围后，乖乖地投降了。,在警察叔叔的包围下，这两个歹徒只能乖乖地束手就擒。,在事实面前，这两个骗子只好乖乖认账了。,A
以下哪句话中“滋润”的意思(或用法)与其他句子不同。,小日子过的还挺滋润。,皮肤滋润。,雨露滋润禾苗。,空气滋润。,A
以下哪句话中“散座”的意思(或用法)与其他句子不同。,我们去散座那里坐吧。,请您到散座就座。,祥子心想：有了自己的车，再去拉包月或散座就没大关系了，反正车是自己的。,他趁没人跑到了散座中。,C
以下哪句话中“走时”的意思(或用法)与其他句子不同。,我们走时正好碰上了雨停了，真是走运的时刻。,当我看到钟表指针缓缓地走时，我意识到时间已经过去了一小时。,在等待的过程中，每一秒钟钟表指针的走时都让我感到无比漫长。,我喜欢静静地坐在沙发上，看着钟表指针不断地走时。,A
以下哪句话中“含金量”的意思(或用法)与其他句子不同。,这让人不禁为这类文凭的“含金量”捏一把冷汗，也难怪有人干脆将一些在职文凭称为“假的真文凭”。,现代人的健康生活含金量高。,现在的粽子啊，它含金量高，吃一个顶过去五个，方便！,据业内人士介绍，足金的含金量纯度千分数不低于九百九十，千足金的含金量纯度千分数不低于九百九十九。,D
以下哪句话中“光大”的意思(或用法)与其他句子不同。,勤劳、勇敢、智慧，这些民族的美德，我们要永远发扬光大。,光大的东西总是让人惊叹。,我们要把雷锋助人为乐的精神发扬光大。,前面谈了那么多，一言以蔽之，就是要继续发扬光大。,B
以下哪句话中“声色”的意思(或用法)与其他句子不同。,别人一直试探他，他却不动声色,在这载歌载舞中，他不近声色,大家先不动声色，以免大吵景色,他不动声色的走出房间,B
以下哪句话中“攻击”的意思(或用法)与其他句子不同。,他常对小明进行人身攻击。,拂晓前，我军向敌人阵地发起攻击。,敌军在我们的猛烈攻击下土崩瓦解了。,恐怖分子的炸弹攻击，不知使多少无辜民众肝脑涂地。,A
