问题,选项1,选项2,选项3,选项4,答案
以下哪句话中“作”的意思(或用法)与其他句子不同。,他在会上向大家作了思想检讨。,杜甫的不少诗篇是属于愤世嫉俗之作。,反动势力正在作垂死挣扎。,党员和群众自觉抵制不良倾向，坚决同各种违法犯罪行为作斗争。,B
以下哪句话中“入口”的意思(或用法)与其他句子不同。,这个车站有五个入口。,我们从入口进去了。,结婚典礼礼堂的入口，摆了一幅新人的结婚照。,糯软香甜、入口即化的富平吊饼是享誉全国的陕西特产,D
以下哪句话中“根本”的意思(或用法)与其他句子不同。,别在那儿痴人说梦了，你根本办不到！,他俩的个性南辕北辙，根本谈不拢。,确切地说，小红根本没有生病。,以人才为本是我国持续发展的根本保证,D
以下哪句话中“金星”的意思(或用法)与其他句子不同。,跑完1000米，我眼睛直冒金星。,生命一旦消失，地球就会回到类似金星、火星等无生命行星一样的表面状态。,金星是太阳系九大行星之一。,既然火星和金星在演化早期可能产生过生命，为什么这些生命没有能形成生物圈？,A
以下哪句话中“保险”的意思(或用法)与其他句子不同。,现在倒有一个保险的办法。,把这些宝石藏在保险箱里。,这对他难道不是太不保险吗？,他靠卖保险为生,D
以下哪句话中“修好”的意思(或用法)与其他句子不同。,停车场还没修好。,是一个老大爷帮我把这车修好了。,这段路修好以后，这条公路就全部贯通了。,两国修好。,D
以下哪句话中“生气”的意思(或用法)与其他句子不同。,他的服务态度让我十分生气,没完成作业老师十分生气,他的脸色苍白，仿佛没有了生气,小孩子极其容易生气,C
以下哪句话中“小号”的意思(或用法)与其他句子不同。,麻烦来套小号的中山装,他因为犯错导致被关小号,保管箱有大有小：分小号，中号，大号。,他适合穿小号的衣服,B
以下哪句话中“低谷”的意思(或用法)与其他句子不同。,人生难免会遇到低谷。,射手座也很敏感，对于身边人的一点冷落都能查觉到，会莫名其妙的纠结，情绪陷入低谷，都是因为骄傲的自尊不肯先低头。,如果你的生活已处于低谷，那就，大胆走，因为你怎样走都是在向上。,低谷中，早先有过一个美丽的小村庄。,D
以下哪句话中“仪表”的意思(或用法)与其他句子不同。,他相貌不凡，仪表堂堂,对于一个人来说，仪容仪表十分重要,他仪表十分出众,这个仪表十分精密,D
以下哪句话中“号称”的意思(或用法)与其他句子不同。,敌人的这个师号称一万二千人，实际上只有七八千。,在唐代诗坛上，李白和杜甫齐名，号称“李杜”。,洋洋乒乓球打得很好，号称“打遍全校无敌手”。,四川号称天府之国。,A
以下哪句话中“餐点”的意思(或用法)与其他句子不同。,店长决定多开几个餐点增加营业额,步行街附近的餐点被取消了,本县的餐点集中于正在开发的旅游区,他们家的餐点我一直很喜欢,D
以下哪句话中“星火”的意思(或用法)与其他句子不同。,这个形成了星火燎原、蓬勃发展的良好态势。,一批“一大三高”型的企业集团、工业小区、三资企业呈现出方兴末艾、星火燎原之势。,白色革命，在三湘大地星火燎原并推向全国，放射出道道耀眼的光芒。,潮落夜江斜月里，两三星火是瓜洲。,D
以下哪句话中“洪量”的意思(或用法)与其他句子不同。,洪量的人都是练出来的，花在酒上的钱不在少数。,他洪量很好，经常千杯不醉。,喝酒不要找洪量的人做对手。,他对任何人都洪量，人们都愿意很他交流。,D
以下哪句话中“鬼祟”的意思(或用法)与其他句子不同。,我看见一个人鬼鬼祟祟地进了院子。,妖魔鬼怪随身就带着鬼祟的气息。,他鬼鬼祟祟的样子让我怀疑他做了什么坏事。,扒手鬼鬼祟祟地，在公共场所偷窃财物。,B
以下哪句话中“夫”的意思(或用法)与其他句子不同。,我的妹夫是一名老师。,一夫当关，万夫莫开。,我的姐夫是一名医生。,她的丈夫很成熟。,B
以下哪句话中“再三”的意思(或用法)与其他句子不同。,郊游时，老师再三声明让我们不要走散。,霸王者，即当时诸侯，诸侯而称本纪，求名责实，再三乖?。,我再三强调，这件事情不要去做。,父母总是会再三提醒我们注意安全。,B
以下哪句话中“面盆”的意思(或用法)与其他句子不同。,妈妈用面盆装满温水，准备给宝宝洗澡。,这家餐馆的特色菜是在铁面盆中烹制的，保持了食物的原汁原味。,她用面盆接水，准备洗脸。,小猫跳进了装满水的面盆里，玩得不亦乐乎。,B
以下哪句话中“支持”的意思(或用法)与其他句子不同。,支持他的做法。,支持阳台的柱子。,支持合理化建议。,互相支持。,B
以下哪句话中“有劲”的意思(或用法)与其他句子不同。,今天的球赛有有意思，看起开真有劲。,这个人真有劲，能挑起二百斤重的担子。,这密室逃脱太有劲了。,大家谈的非常有劲。,B
以下哪句话中“时气”的意思(或用法)与其他句子不同。,患了时气的人要注意休息。,时气好。,碰时气。,有时气。,A
以下哪句话中“吃瓜”的意思(或用法)与其他句子不同。,我只是一个不明真相的吃瓜群众,炎炎夏日多吃瓜，补水防暑降血压,吃瓜人开窗扔瓜皮打一成语：吃里扒外。,几番觥筹交错之后，宇文招端着个瓜盘殷勤地请杨坚吃瓜，其间，刺瓜的小刀就在杨坚喉咙间闪躲，但宇文招摆弄了几次，就是没有胆气刺下去。,A
以下哪句话中“融融”的意思(或用法)与其他句子不同。,他们手牵着手，笑意融融，坐在离我三个桌子远的位子上。,春光融融。,大家欢聚一堂，其乐融融。,过年过节乐融融，防火工作莫放松。,B
以下哪句话中“绷弓子”的意思(或用法)与其他句子不同。,绷弓子是一种装在门上用来自动关门的装置,小孩，别用绷弓子打鸟！,小孩最常见的玩具就是绷弓子了,前两天叔叔送了我一把绷弓子,A
以下哪句话中“白白”的意思(或用法)与其他句子不同。,有知其阳阳而阴阴，白白而黑黑也。,他能那么好心，白白送你？,这些都是无代价的，白白给你,这些东西不能白白送给你。,A
以下哪句话中“孤单”的意思(或用法)与其他句子不同。,他孤单一人在异国他乡。,面对强大的对手，他们势力孤单。,无儿无女的老人住进敬老院，一点儿也不感到孤单。,妈妈和爸爸都去上班了，小华在家很孤单。,B
以下哪句话中“上风”的意思(或用法)与其他句子不同。,他在我的耳边象狗叫般一笑，踱到船尾楼甲板的上风方向去了。,烟气从上风刮过来。,这场球赛，上半场甲队占上风。,在上风方向喷洒农药。,C
以下哪句话中“原本”的意思(或用法)与其他句子不同。,请提供这份文件的原本原稿，以便我们进行核实。,她原本是一个害羞的人，但经过一段时间的培训和锻炼，她变得自信而开朗。,这份文件是原本的原稿，没有经过传抄或修改。,我们需要确保这份文件是原本的原稿，以保证信息的准确性。,B
以下哪句话中“迂回”的意思(或用法)与其他句子不同。,迂回曲折。,迂回包抄。,迂回路线。,迂回战术。,A
以下哪句话中“正房”的意思(或用法)与其他句子不同。,我家正房是一家之主。,他是我的正房。,我家正房朝南。,我们家的大事小事都听正房的。,C
以下哪句话中“屈节”的意思(或用法)与其他句子不同。,他虽然没什么出息，但也不愿卑恭屈节。,为了生活，他愿意卑躬屈节。,屈节事仇。,一个人犯了错该向人道歉，但不应该卑躬屈节。,C
以下哪句话中“孩子头”的意思(或用法)与其他句子不同。,孩子头指老跟孩子们在一起玩的成年人。,小明是个孩子头，经常带着一群孩子到处玩。,作为孩子头的李明，总是命令他的小弟们做这做那。,村里的孩子头虽然调皮，但对待老人很有礼貌。,A
以下哪句话中“广角镜”的意思(或用法)与其他句子不同。,取景时别具匠心地使用了电传和广角镜头。,为什么你反对用广角镜头？,这部百科全书是开阔眼界、增长知识的广角镜。,我无需调整焦距，因为我用的是广角镜头。,C
以下哪句话中“残毒”的意思(或用法)与其他句子不同。,暴君对他的臣子十分残毒,大将军因为行事残毒而遭受大臣弹劾,苹果上的残毒让他进了医院,这个国家的军队以残毒的行为闻名,C
以下哪句话中“转悠”的意思(或用法)与其他句子不同。,我就在外面转悠一会儿我就回来。,每天我出去转悠一下。,不要出去瞎转悠。,眼珠子转悠。,D
以下哪句话中“光杆儿”的意思(或用法)与其他句子不同。,父母一死，只剩他光杆儿一人。,你要是再晚一点儿出来，估计就快成了光杆儿司令了。,还是我好，没爹没娘，光杆儿一个，死了就死了，无牵无挂。,我看着这些还是光杆儿的树，还有泛黄的草儿。,D
以下哪句话中“韧性”的意思(或用法)与其他句子不同。,这根尺子韧性不好。,工作任务越艰巨越需要韧性。,树枝韧性不好，要当心。,筷子韧性不够，不好夹菜。,B
以下哪句话中“故意”的意思(或用法)与其他句子不同。,怕同学们接受不了，老师故意把话说得很委婉。,老师故意用粉笔敲敲黑板，以引起大家的注意。,守门员故意拖延时间，受到裁判的黄牌警告。,十?亦不醉，感子故意长。,D
以下哪句话中“过不去”的意思(或用法)与其他句子不同。,他总是挑我的毛病，这是存心与我过不去。,他处处怀疑别人在跟他过不去，真是以小人之心，度君子之腹。,自从上次吵架后，她一直跟我过不去，也不知她安的什么心。,大桥正在修理，这里过不去。,D
以下哪句话中“油水”的意思(或用法)与其他句子不同。,油水分离器可处理油污水。,捞油水。,油水不相容。,这饭菜的油水太多了。,B
以下哪句话中“得手”的意思(或用法)与其他句子不同。,这个小偷在一度得手后，食髓知味，再度光临，终于被逮个正着。,这起抢案，警方怀疑有内贼接应，才使歹徒轻易得手。,小偷得手后，还堂而皇之地从大门口走了出去。,工作进行得很得手。,D
以下哪句话中“抄手”的意思(或用法)与其他句子不同。,我喜欢吃麻辣抄手。,抄手真是美味极了！,抄手向前咨大使，这回不敢恼儿郎。,我今天晚上去吃抄手。,C
以下哪句话中“应变”的意思(或用法)与其他句子不同。,在面对突然发生的紧急情况时，我们需要灵活运用应变能力来做出正确的决策。,这个金属材料在受到高温作用后发生了应变，导致其形状发生了相对改变。,面对突如其来的挑战，我们团队展现出了出色的应变能力，顺利完成了任务。,这个项目遇到了一些意外情况，但我们通过及时的应变措施成功解决了问题。,B
以下哪句话中“盈盈”的意思(或用法)与其他句子不同。,盈盈一水间。,她在宫殿上盈盈起舞。,春水盈盈。,荷叶上露珠盈盈。,B
以下哪句话中“自流”的意思(或用法)与其他句子不同。,自流水。,自流井。,自流灌溉。,晚自习不许自流。,D
以下哪句话中“撞车”的意思(或用法)与其他句子不同。,撞车事故。,小心开车，以防万一撞车。,安排不周，两个会撞车了。,前面发生了撞车，不要去看。,C
以下哪句话中“四方”的意思(或用法)与其他句子不同。,他有个四方形的盒子，里面是他珍贵的东西。,神鹰飞翔，志在四方；凤凰纹完，好运当前。,好男儿志在四方，整天守在家里有什么出息？,青年人志在四方，何必一定要留在大城市才行呢？,A
以下哪句话中“挂彩”的意思(或用法)与其他句子不同。,两人回到家，只见整个风府披红挂彩，比起昨天来，又多了一分喜庆。,他两条腿都挂彩了，人也被如雨的弹片炸成重伤。,见得人都说，那匾披红挂彩，镌了四个斗大金字——德为福基。,节日到了，商店里披红挂彩，装扮的十分鲜艳夺目。,B
以下哪句话中“下场”的意思(或用法)与其他句子不同。,欺凌别人绝没有好下场。,下场比赛很关键。,解放前张先生到海外打工，梦想衣锦还乡，结果却落了个暴尸街头的下场。,敌人对我军阵地进行偷袭，正好中了我军的埋伏，结果落了个全军覆没的下场。,B
以下哪句话中“分号”的意思(或用法)与其他句子不同。,我们店只此一家，没有分号,他用分号将句子中的独立子句分隔开来，以增加句子的清晰度。,在写作中正确使用分号可以表达更复杂的句子结构和逻辑关系。,这篇文章的标点符号使用得很准确，尤其是分号的运用使得句子的含义更加明确。,A
以下哪句话中“贵贱”的意思(或用法)与其他句子不同。,人生不论贵贱，一日有一日合作之事，若饱食暖衣，无所事事，哪得有结果。,我劝了他半天，贵贱不听。,贵贱之分，在于行之美恶。,百体皆血肉之躯，五官有贵贱之别。,B
以下哪句话中“切面”的意思(或用法)与其他句子不同。,他晚上自己一个人在家切面吃。,睾丸纵切面，示生精小管和迂回蟠曲的附睾。,肝脏的切面显示了肝脏腺瘤。,肿瘤呈紫红色或紫蓝色，质多柔软，界清，切面呈网状。,A
以下哪句话中“子息”的意思(或用法)与其他句子不同。,他的子息都很孝顺。,他有三个子息。,一个月子息多少。,他五十岁了，现在任无子息。,C
以下哪句话中“海市蜃楼”的意思(或用法)与其他句子不同。,海市蜃楼是世界上的一大奇观。,蓬莱是中国著名的旅游城市，这里因经常出现海市蜃楼奇观而被誉为“人间仙境”。,富贵利禄对他而言，有如海市蜃楼，转眼成空。,海市蜃楼是罕见的奇特景象。,C
以下哪句话中“巨婴”的意思(或用法)与其他句子不同。,这个团队里有一个巨婴，总是喜欢抱怨和指责别人。,那个成年人行为举止总是像个孩子，真是个巨婴。,这个婴儿体形巨大，是个巨婴,他经常把别人的责任推卸掉，真是一个巨婴。,C
以下哪句话中“热浪”的意思(或用法)与其他句子不同。,沙漠上阵阵的热浪扑面而来。,太阳挂在空中，热浪一波波袭来。,商品生产的热浪原来越高。,这阵热浪已使人感到疲惫。,C
以下哪句话中“皇粮”的意思(或用法)与其他句子不同。,清王朝覆灭后，八旗贵族断了皇粮，不少只会吃喝嫖赌、百无一能的纨绔子弟沦为乞丐。,人们称政府官员是吃皇粮的工作人员。,现在吃皇粮的都是国家工作人员。,在事业编制，可以吃皇粮。,A
以下哪句话中“现世”的意思(或用法)与其他句子不同。,这样的“老太婆”还出来念什么书，活现世！轻薄的同学的口角边，往往会漏出了这样的嘲笑。,因果论或现世报论者提出：种何因，结何果。因果报应，如影随形。,乃至大小喜怒、毁谤、打骂、是非，见面相嫌，皆是前因所结旧冤，现世要还。,他们认为，如果人的福祸同现世的善恶行为无关，这就会使人善恶不分。,A
以下哪句话中“呱唧”的意思(或用法)与其他句子不同。,现在有请项风，这次获得村内选冠军，来讲话，大家呱唧呱唧！,这两个人身子一僵，呱唧栽倒在地上，哆嗦两下便再也不能动了。,他便这样漫无目标地活着，古费拉克却说他是傻里呱唧地活着。,这才一眨巴眼儿的功夫，韩彪呱唧呱唧摔了一地的蛤蟆。,A
以下哪句话中“正职”的意思(或用法)与其他句子不同。,他没有正职。,这些干部有担任正职的，也有担任副职的。,他的正职是教师。,你的正职是什么。,B
以下哪句话中“雨水”的意思(或用法)与其他句子不同。,雨水调和。,雨水是二十四节气之一。,雨水充足。,雨水从天上洒落下来。,B
以下哪句话中“全家福”的意思(或用法)与其他句子不同。,每天我们去拍全家福。,今天，妈妈照着菜单做了一大桌全家福。,墙上挂着一张全家福。,这张全家福拍的很好看。,B
以下哪句话中“孩提”的意思(或用法)与其他句子不同。,他还是一个孩提。,在孩提时期，我不能想象还有什么需要比父亲的保护更强烈。,我多么想跨出这禁地，奔向那回家之路。是多么想回到孩提时代，无忧无虑地生活，将那些令人讨厌的烦恼统统抛之脑后。,年近而立，孩提时代积攒的或多或少的好印象随之趋淡。,A
以下哪句话中“插口”的意思(或用法)与其他句子不同。,插口是一种方便的电源接口，广泛应用于中国大陆的家庭和办公场所。,中国政府在插口标准化方面的努力，将为人民提供更好的生活品质和便利。,中国政府积极推动插口标准化工作，以确保电器设备的安全性和互通性。,插口也具有动插嘴的意思,D
以下哪句话中“中道”的意思(或用法)与其他句子不同。,中道即中庸之道。,中道弃娟。,中道而返。,中道而废。,A
以下哪句话中“emo”的意思(或用法)与其他句子不同。,“emo”是一种与朋克相似的摇滚乐，最初从HardcorePunk(硬核朋克)中派生出来，但包含更为复杂的改编曲，歌词更多触及情感主题。,以后不在朋友圈装emo了，其实我这个长相，根本没有那么多感情问题,明天开学要分班，狠狠emo了。,我emo了，有一瞬间我想过死亡。,A
以下哪句话中“黑白”的意思(或用法)与其他句子不同。,老师处理同学的矛盾很有原则，从不颠倒黑白。,你要保持清醒的头脑，不能黑白颠倒，是非不分。,他总是黑白混淆，颠倒是非。,横盘上黑白分明，双方胜负已分。,D
以下哪句话中“约略”的意思(或用法)与其他句子不同。,我约略知道他的一些事。,我约略知道一些。,他的近况我约略知道一些。,约略听得见窗外的雨点声。,D
以下哪句话中“照直”的意思(或用法)与其他句子不同。,有话就照直说，不要吞吞吐吐。,照直往前走，不要回头。,照直走。,照直往东就到了。,A
以下哪句话中“关系”的意思(或用法)与其他句子不同。,他俩虽然闹矛盾，但还没有到关系破裂的程度。,新社会与旧社会有千丝万缕的关系。,由于时间关系，我不往下讲了。,李华与朱茵断绝了朋友关系。,C
以下哪句话中“官人”的意思(或用法)与其他句子不同。,周代选士制、汉代察举制、魏晋九品官人制是考试制度的起源阶段。,内外官人被诸道按察使及御史所摘伏，咸宜洗涤；选日依次叙用。,蔡大官人，我这姑娘确实是这大名府的数一数二的美人。,官人，早日回家探望病床上的母亲。,D
以下哪句话中“含糊”的意思(或用法)与其他句子不同。,这活儿干得真不含糊。,说明白一点吧，不要含糊其辞。,他回答得很含糊，令人费解。,对于老师的提问，小东回答得很含糊。,A
以下哪句话中“烧心”的意思(或用法)与其他句子不同。,白菜烧心了，真可惜。,患有烧心，胃酸过多的毛病。,常有烧心感，真的很难受。,辣椒吃多了容易烧心。,A
以下哪句话中“团团”的意思(或用法)与其他句子不同。,团团的小脸儿。,团团围住。,他骗得大家团团转。,大家都围着他团团转。,A
以下哪句话中“横流”的意思(或用法)与其他句子不同。,在这个物欲横流的世界，在这个人心不古的社会，我们只能随波逐流。,在黑暗的旧社会里，人欲横流，道德沦丧，社会风气日趋败坏。,老人想起了多年未见的儿子，不禁涕泪横流。,刘兄，树大招风，如今人欲横流，你还是避一下为好。,C
以下哪句话中“规整”的意思(或用法)与其他句子不同。,规整衣物。,这里有一座古老的教堂。建筑古雅，不很规整，是有山墙的那种房子。,同学们的作业都写得很规整。,阅览室里的图书、报刊总是摆得规规整整的。,A
以下哪句话中“如意”的意思(或用法)与其他句子不同。,没有一件事让人如意的。,这玉如意一看就价值不菲。,这世间的事哪能事事如意。,今天实在运气不好，做什么都不如意。,B
以下哪句话中“买单”的意思(或用法)与其他句子不同。,他深陷债务困境，无法买单还债，陷入了经济困境。,在商务会议结束后，公司老板买单请客，表示对员工的慰劳和认可,他们在餐厅享用完美食后，友好地争着买单，表达彼此的感激之情,我们一起吃饭，轮到我买单了，我拿出钱包付了账。,A
以下哪句话中“海口”的意思(或用法)与其他句子不同。,海口是中国海南省的省会城市，拥有美丽的海滩和独特的热带风情。,海口有许多著名的旅游景点，例如骑楼老街、五公祠和大小洞天，吸引了大量游客的到访。,我计划下个月去海口度假，享受阳光、沙滩和海洋的美妙。,他对着我们夸下海口说今天一定办成,D
以下哪句话中“音儿”的意思(或用法)与其他句子不同。,今天的音儿怎么和昨天不一样了？,他记得连说话的音儿都变了。,他的音儿怎么了？,听话听音儿。,D
以下哪句话中“好处”的意思(或用法)与其他句子不同。,他肯定给了你不少好处！,有些干部千方百计地为自己捞取好处。,改革开放促进了经济发展，每个人都从中获得了好处。,最是一年春好处，?胜花柳满皇都。,D
以下哪句话中“有染”的意思(或用法)与其他句子不同。,他们婚外有染。,与上次的暴力事件有染。,与黑社会有染。,与黑暗势力有染。,A
以下哪句话中“杀气”的意思(或用法)与其他句子不同。,他们杀气腾腾地闯进屋来，翻箱倒柜，抢了值钱的东西，扬长而去。,看到这伙杀气腾腾的歹徒，他恨恨不已。,当你心情难过时不要拿别人杀气，否则会没人和你交朋友。,两位剑客互相对峙，目光如炬，全身散发出杀气。,C
以下哪句话中“画卷”的意思(或用法)与其他句子不同。,长篇小说《李自成》展示了明末农民起义的历史画卷,进了长江三峡，就好像走进了一幅连绵不断的山水画卷。,屡出诗章新管?，偶开画卷小山川。,畅游漓江，饱览桂林山水，犹如欣赏百里画卷。,C
以下哪句话中“换代”的意思(或用法)与其他句子不同。,历史上的改朝换代总伴随着血腥的战争。,各种皮凉鞋虽然款式新，换代快，但价格比较高。,空军的飞机在不断更新换代。,随着计算机的更新换代，它的功能越来越多了。,A
以下哪句话中“内因”的意思(或用法)与其他句子不同。,深入研究导致事情发生的内因，有助于使我们更全面地了解这件事情。,这件事情的内因值得我们深思。,唯物辩证法认为外因是变化的条件，内因是变化的根据，外因通过内因而起作用。,行人可不有私？不。有私，所以为内因也。,D
以下哪句话中“鼓动”的意思(或用法)与其他句子不同。,运动会上，文娱委员负责宣传鼓动工作。,在老师的鼓动下，我们打扫了操场。,经他鼓动，不少人都加入了篮球队。,小燕子鼓动着翅膀向远处飞去。,D
以下哪句话中“合拍”的意思(或用法)与其他句子不同。,这对舞蹈伴侣的舞技水平相当高，他们的舞姿流畅而协调，每一次演出都令人惊叹的合拍。,今天天气很好让我们合拍一张照片吧,在比赛中，这支球队展现出了出色的团队合作，他们的配合简直就是无懈可击的合拍。,这部电影的主角和配角在镜头前表现得非常默契，他们合拍得很完美。,B
以下哪句话中“华盖”的意思(或用法)与其他句子不同。,吉华盖；凶截路，破字，曲脚。,吉华盖；凶大败，平头，破字。,凶华盖，羊刃，退神，破字。,正五品，内阁，旧名华盖殿。,D
以下哪句话中“归结”的意思(或用法)与其他句子不同。,一切经济最后都归结为时间经济。,这件事儿总算有了一个归结。,把友谊归结为利益的人，为是把友谊中最宝贵的东西勾销了。,一切教育都归结为养成儿童的良好习惯。,B
以下哪句话中“阵痛”的意思(或用法)与其他句子不同。,阵痛之后便是安宁。,今天开始阵痛。,牙痛引起的阵痛。,宫缩引起阵痛。,A
