问题,选项1,选项2,选项3,选项4,答案
以下哪句话中“配方”的意思(或用法)与其他句子不同。,通过配方，方程变成了完全平方式。,还没有把握是否能找到一个配方。,还是原来的配方，还是原来的味道，客人们都吃的非常的开心。,我们自己生产护发产品，都使用草药配方。,A
以下哪句话中“装饰”的意思(或用法)与其他句子不同。,装饰的华丽可以显示出一个人的富有,这位装修工用极其现代化的陈设装饰这家旅馆。,极具艺术气息的装饰画，如摩登女郎般跃然于空中，打破传统限制,商店的橱窗里陈列着许多漂亮的装饰品。,B
以下哪句话中“陆”的意思(或用法)与其他句子不同。,上课铃声响了，正在游戏的同学们陆续地回教室准备上课。,图上部的横线段表示陆地。,陆上侵蚀常夷平成准平原。,经济萧条正在大陆上蔓延。,A
以下哪句话中“黄牛”的意思(或用法)与其他句子不同。,我去年就被迫向黄牛党买票。,如果年检费涨价了，年检站肯定会为客户提供一站式的年检服务，让车主不用再找“黄牛”代办。,黄牛们坚持漫天讨价。,黄牛虽然没有荷兰牧场的黑白花牛漂亮，但是它却很勤劳，和家乡里的人一样。,D
以下哪句话中“骨干”的意思(或用法)与其他句子不同。,哥哥参加工作不久，就成了研究所的业务骨干。,加强对国有骨干企业领导人员的管理,将每棵树作为一个树冠很矮的骨干枝来处理,我们应该把这些教学骨干大胆地提拔起来。,C
以下哪句话中“洗刷”的意思(或用法)与其他句子不同。,在我的洗刷下，我的臭球鞋变得焕然一新。,有些罪过只能补赎，不能洗刷！,秋雨洗刷过的天空，像大海一样湛蓝碧透。,雨水把街道洗刷了一遍，街道显得格外亮堂，都可以照出人影来了！,B
以下哪句话中“开方”的意思(或用法)与其他句子不同。,明智的大夫在开方之前先诊断。,求二进制数的乘方和开方的方法有多种。,一种最优的快速开方算法。,怎样算一个数的开方？,A
以下哪句话中“位置”的意思(或用法)与其他句子不同。,变换词语的位置，可以改变句子的内容。,在一个安静的位置上，看世界的热闹，去看热闹背后的无线广袤的世界，这也许是最合适我的性情的一种活法。,在公司中，爬到这个位置不容易,我就坐在我的位置上都没有变过,C
以下哪句话中“山头”的意思(或用法)与其他句子不同。,这几个家伙不愧是妖族的精英人员，拉山头的本事还真不小。,站在山头，青山绿水尽收眼底，令人心旷神怡。,连长仔细观察地形后，决定在山头的树林中设下埋伏。,此外，还有那些喜欢孤独的人，开车一路走着，你会看见一座小山头上矗立着一栋活动房屋，俯临着美丽景色。,A
以下哪句话中“倾倒”的意思(或用法)与其他句子不同。,一场大风使船倾倒。,他那精彩的表演令全场观众为之倾倒。,江山如此多娇，多少人为之倾倒！,回想当年他翩翩年少，不知有多少女孩子为他倾倒。,A
以下哪句话中“小儿科”的意思(或用法)与其他句子不同。,综合性医疗网站，提供妇产科小儿科内科以及外科资讯和讨论。,不，都太小儿科了。一定得是谋杀，血淋淋的谋杀，不过要做得干净利落。,我是小儿科医生，我叫djaberansari,小儿科医生玛丽亚说，影迷俱乐部拜访医院，会提升孩童的士气。,B
以下哪句话中“关门”的意思(或用法)与其他句子不同。,防盗警报响起后，员工们立即关门并通知警察。,由于人流已经结束，工作人员决定提前关门。,晚上10点是商店关门的时间，顾客需及时结账离开。,然大肠之不固，仍责在胃，关门之不紧，仍责在脾。,D
以下哪句话中“出口”的意思(或用法)与其他句子不同。,产量中有二十分之一出口。,你想出口成章，就得多读书，还要经常练习演讲。,我们的出口贸易已有些萎缩。,出口了货物，收进了外汇。,B
以下哪句话中“沐浴”的意思(或用法)与其他句子不同。,他正在洗澡间里沐浴。,一轮晚月升上天空，仓库的空场沐浴在月光之中。,温暖的沐浴使我放松。,在炎热的夏季，每天都可以用冷水沐浴。,B
以下哪句话中“光阴”的意思(或用法)与其他句子不同。,人生真的是一寸光阴一寸金。,虚度光阴，就等于浪费生命。,见龙驹持一月来相照，光阴所及，如冰著体，冷彻腑?。,光阴似箭，岁月如梭，要珍惜时间啊！,C
以下哪句话中“可以”的意思(或用法)与其他句子不同。,我可以邀请您跳这个舞吗？,你可以删掉不重要的细节。,你是问我这个怎么样是吗？我觉得可以。,病毒可以存在于自来水中。,C
以下哪句话中“结果”的意思(或用法)与其他句子不同。,院子里的小树结果了。,这场比赛激烈地进行着，最后的结果是双方战平。,他努力学习，最终的结果是他取得了优异的成绩。,他们经过漫长的辩论，结果达成了一个共识。,A
以下哪句话中“影响”的意思(或用法)与其他句子不同。,研究了在模拟太阳光和高压汞灯作用下，不同浓度的光催化剂和紫外光辐射强度对孔雀绿废液的光催化降解影响。,他从小受到古典音乐的影响。,故障电流限制器能够对公用电网中意外的电力干扰作出影响并消除这些干扰，防止客户的电能损失，防止损坏公用电网设备。,还对苯酚在蒙脱石修饰碳糊电极上的影响机理进行了探讨。,B
以下哪句话中“回肠”的意思(或用法)与其他句子不同。,范大昌走后，杨晓冬回肠九转，脑子里翻腾滚转着今后的问题。,回肠是人体器官名。,回肠的特点是，一侧缘连以肠系膜，另一侧缘有回肠进入盲肠的部位。,回肠，指连接空肠和盲肠的一段小肠，形状弯曲。,A
以下哪句话中“机动”的意思(或用法)与其他句子不同。,我也想有一辆机动车。,这笔经费你们可以机动使用。,你需要明确机动车第三者责任强制保险的功能。,机动车发生交通事故造成损害的，依照道路交通安全法的有关规定承担赔偿责任。,B
以下哪句话中“波罗蜜”的意思(或用法)与其他句子不同。,于念念中常修六波罗蜜，修慈心时，未离分别，未能不起我我所见。,他取出大字刻版的四本《金刚般若波罗蜜经》。,卖波罗蜜的是一个年轻娇小的小姐。,一场诵仁王护国般若波罗蜜经大会正在进行。,C
以下哪句话中“口服”的意思(或用法)与其他句子不同。,你的观点我虽然驳不倒，但并没有使我心服口服。,您可以服用口服退烧药。,这种粗暴的家长式作风，一言堂，肯定不会令所有人心服口服,老师摆事实讲道理，说得同学们心服口服。,B
以下哪句话中“突出”的意思(或用法)与其他句子不同。,这块岩石突出了一块,战士们突出了重围,做演讲时要突出重点,小明的成绩突出,B
以下哪句话中“活动”的意思(或用法)与其他句子不同。,这几个月来，老杨四处活动，机关用尽，也没能捞到官职。,班里的重要活动，如外出参观，召开家长会等，事先都要向校长请示。,同学们一再要求多开展些健康有益的课外活动。,咱们学校的课外活动丰富多彩。,A
以下哪句话中“空洞”的意思(或用法)与其他句子不同。,他用空洞的诺言欺骗了我。,若出现空洞，其直径总和小于4厘米。,在塔内的空洞部分填满高强混凝土。,河岸由于流水冲刷而成空洞。,A
以下哪句话中“风化”的意思(或用法)与其他句子不同。,公共场合裸露，有伤风化。,他败坏、损害社会的风化和教化。,不能借口解放思想，突破禁区，对一些有伤风化，危害治安的事情开口子。,这块石头风化严重。,D
以下哪句话中“新生”的意思(或用法)与其他句子不同。,原有的家系是一个法人团体，新生的家系也是法人团体。,新生儿时期是心理现象的发生时期，是个体心理活动的起点。,我当然快乐了，突然成为了北大新生班级的班长。,新生儿仰卧时，头常常偏向一侧，同时伸出该侧的手臂和腿，作出击剑状。,C
以下哪句话中“吐气”的意思(或用法)与其他句子不同。,藏獒发出了沉重的吐气声,赢得了比赛，他们终于可以扬眉吐气了,考上了重点大学，他扬眉吐气了,北京奥运会的圆满举办让中国人扬眉吐气,A
以下哪句话中“后天”的意思(或用法)与其他句子不同。,后天就要交作业了。,后天再说这事吧。,学习更多要靠后天的努力。,后天去哪玩啊？,C
以下哪句话中“低头”的意思(或用法)与其他句子不同。,我低头闻见一阵芬芳,生活中有很多不得不低头的瞬间,遇到困难，不允许低头,在生活中不允许你低头,A
以下哪句话中“左右”的意思(或用法)与其他句子不同。,从攻防的场面上看，主队已经左右了局势。,正如你所知，这段感情左右着我的一切，使我不能自已。,他是个双手拿枪的神枪手，左右两手均能百步穿杨。,是他的想法在左右着你？,C
以下哪句话中“究竟”的意思(或用法)与其他句子不同。,门前围满了人，小勇也想去看个究竟。,这件事我要探个究竟！,这个山洞里到底住着谁，我想探个究竟。,究竟怎么办，到时你见机行事好了。,D
以下哪句话中“丫头”的意思(或用法)与其他句子不同。,尤其丫头们跟着主子，吃香的喝辣的不说，日常待遇也不比一般人家的小姐差,小丫头片子整天不务正业不好好学习，居然跑出去赚钱,感谢这河水滋润了我们生长的土地，保佑我的丫头快快健康长大。,你们从懵懂少年和黄毛丫头长成英俊潇洒和亭亭玉立的俊男靓女,A
以下哪句话中“印花”的意思(或用法)与其他句子不同。,我喜欢在被子上印花,由政府有关部门发售，规定贴在契约、凭证等上面，作为税款的一种特制印刷品。全称印花税票。,工人会在产品包装上印花,印花也是个技术活,B
以下哪句话中“空门”的意思(或用法)与其他句子不同。,我这些徒弟都是危难之时遁迹空门，自然不那么诚心。,他刚错过了一个空门得分的机会。,手心和背上的万字符号，悲惨的人生经历，注定了他要遁入空门。,他的才华如此灿烂，可是他把光华全部收敛起来，避世绝俗，遁入空门。,B
以下哪句话中“小节”的意思(或用法)与其他句子不同。,她是个不拘小节的人。,小节不慎，大节难保。,这首歌有好几个小节。,我们是来带领乡亲们走出贫困，你要盱衡大局，别跟小节过不去。,C
以下哪句话中“清明”的意思(或用法)与其他句子不同。,每到清明，我们都要去瞻仰烈士墓。,清明前后，桃花、杏花、李花都陆续开放了。,今晚月色清明，正是游玩的好时刻。,清明过后，一连下了三天雨。,C
以下哪句话中“裁判”的意思(或用法)与其他句子不同。,足球场上，个别运动员动作粗野，受到裁判的警告。,他的父亲是本届亚运会的排球裁判。,在赛场上，足球运动员应服从裁判的判决。,法官要站在公正的立场来裁判案件。,D
以下哪句话中“光景”的意思(或用法)与其他句子不同。,二十年的光景，他已变成了白发苍苍的老者。,今天太闷热，光景要下雨。,这几年，家里的光景一年比一年好起来了。,几年的光景，那个大姐姐已出落成一位亭亭玉立的大姑娘了。,B
以下哪句话中“沉着”的意思(或用法)与其他句子不同。,姐姐生怕留下疤痕和色素沉着。,面对来势汹汹的大军，他沉着应对。,老师对他的评价是，沉着冷静。,摩尔的性情相当沉着、平静。,A
以下哪句话中“作为”的意思(或用法)与其他句子不同。,必须好好学习有所作为,我把游泳作为锻炼身体的方法。,你必须有所作为,生活中要做一个有作为的人,B
以下哪句话中“女工”的意思(或用法)与其他句子不同。,她性格大大咧咧的，不会做女工。,工厂既雇用男工，也雇用女工。,纺织女工向秀丽为抢救国家财产而光荣牺牲。,女工产假期间工资照发。,A
以下哪句话中“待遇”的意思(或用法)与其他句子不同。,县级参公管理和乡镇公务员在待遇上是有区别的。,待遇越高，执行结果越坏。,很多人认为前任部长们一年仅参加几次理事会就轻而易举地捞取了25，000英镑的待遇。,他受到不公平待遇却仍能安之若素。,D
以下哪句话中“流产”的意思(或用法)与其他句子不同。,妇女可以选择药物流产或手术流产。,流产后一般需要休息半个月或一个月民间称这段时间为“小月子”。,目的探讨习惯性流产有效的治疗方法。,我精心准备的活动流产了。,D
以下哪句话中“用心”的意思(或用法)与其他句子不同。,他学习十分用心,他对我别有用心,他上课用心听讲,你学习能不能用心？,B
以下哪句话中“背书”的意思(或用法)与其他句子不同。,父亲经常和我比赛背书，虽说他丢掉书本已有二十多年，但比赛起来我总是输，他的很多知识好像都在脑海印着似的。,经过背书的票据，付款人不能付款时，背书人负付款责任。,背书也跟状态有关的，如果你太急躁了，不妨停一下，放轻松点，太逼自己会背不进去。,他夜以继日的在背书,B
以下哪句话中“进口”的意思(或用法)与其他句子不同。,医院的进口在那里。,各国都在那里想法子加增货物的出口和金银的进口。,这可是进口货啊！,为了降低这些企业投资和进口技术设备的成本，政府不得不对要素价格做出各种扭曲。,A
以下哪句话中“拍子”的意思(或用法)与其他句子不同。,他对工具摆放的位置，都有明确要求，看到有不合格的工具，譬如扎得不好的蘸水笔，削得粗糙的竹拍子，拿起来就往窗外扔去。,和同伴格格不入的人，或许只是因为他听到的拍子不一样。,拍膝盖，打拍子这一类的幽默都通过很多形式表现出来。,板是以前演奏音乐时，用来打拍子的工具，也可指音乐的节奏。,A
以下哪句话中“花费”的意思(或用法)与其他句子不同。,注意饮食习惯，省下看医生的花费。,劳而无功意思是花费了力气，却没有收到成效。,伟大的成就，来自为远大的目标所花费的巨大心思和付诸的最大努力。,顶尖运动员花费许多时间练习，使自己更加卓越。,A
以下哪句话中“麻雀”的意思(或用法)与其他句子不同。,麻雀从来没有南飞，可它在人们眼里却很卑微,他打一根麻雀，我就胡了,一只麻雀，亮晶晶的圆眼睛，滴溜溜地望着天空。,麻雀站在树枝上，秋天的童话只剩下这一个干干净净的画面。,B
以下哪句话中“战机”的意思(或用法)与其他句子不同。,一名战地指挥员，最可怕的是反应迟钝，抓不住战机。,拉脱维亚、立陶宛和爱沙尼亚在2004年与北约达成协议达成了租赁战机对他们的领空巡逻。,他自己动手做了一个战机,那架战机时而俯冲低飞，时而冲天直上。,A
以下哪句话中“火星”的意思(或用法)与其他句子不同。,生命一旦消失，地球就会回到类似金星、火星等无生命行星一样的表面状态。,火星和金星在演化早期也具有前生命化学进化的必要条件。,上述发现还不能算是火星生命的直接证据。,他在打铁时，火星四溅。,D
以下哪句话中“眼线”的意思(或用法)与其他句子不同。,他总觉得我是老板派来的“眼线”，是来监视他的。,为了防止画时因手抖动影响眼线的清晰，可用小手指支撑着脸部。,借助眼线的描画，能使眼睛变得传神。,而纹眼线则能增加面部层次，使人陡生风采。,A
以下哪句话中“龙头”的意思(或用法)与其他句子不同。,用完了水，要随手关上水龙头。,使用节水的龙头、莲蓬头和厕所水箱。,中央宝座的靠背雕四个龙头，伸向两端。,龙头没有关紧，白白地浪费了许多水。,C
以下哪句话中“一线”的意思(或用法)与其他句子不同。,县长亲自在一线指挥抗洪抢险。,我们前往车间慰问一线工人,树林里透过一线阳光,他前往了抗疫一线,C
以下哪句话中“苹果”的意思(或用法)与其他句子不同。,她的脸红的就像苹果一样。,桌上的苹果被人咬了一口。,今天苹果的售价是三斤十元。,苹果的铃声很有辨识度。,D
以下哪句话中“古董”的意思(或用法)与其他句子不同。,死不开窍的老古董。,优质的古董是一项极好的投资，这间艺廊的黎巴嫩裔主人阿里？雅博达姆说。比起一幅毕卡索来，买古董的价钱可以说是九牛一毛。,许多古董像是蚌壳里的珍珠般被放在橱窗里,爱吃有品味懂得生活的蔡辰洋，将美食古董与音乐合而为一，寒舍食谱卖的是鱼翅鲍鱼，摆的是真迹真品，听的是中国古乐，顾客彷佛坐在故宫里吃御膳。,A
以下哪句话中“成年”的意思(或用法)与其他句子不同。,作为一个成年人，你们要负起责任。,我们该给孩子举办一个成年礼。,父亲成年在外奔波。,孩子已经成年了。,C
以下哪句话中“早晚”的意思(或用法)与其他句子不同。,立秋过后，早晚有了些凉意。,跟这帮狐朋狗友来往，你早晚会进监狱。,你不应该这么助桀为虐，早晚会遭天谴。,那些不遵守法律的人早晚会自作自受，得到制裁。,A
以下哪句话中“转机”的意思(或用法)与其他句子不同。,尽管事情发展一度不利，但他们没有放弃努力，最终通过转机成功地解决了问题，避免了更大的损失。,他选择了一条经过迪拜的航线，中途转机到达目的地。,尽管他的病情一度危急，但经过紧急手术后，他的状况开始转机，医生们对他的康复充满信心。,在经济危机中，企业采取了一系列措施，希望能够通过转机来挽回局势，恢复盈利。,B
以下哪句话中“座机”的意思(或用法)与其他句子不同。,诺沃特尼报告说自己座机左发动机受损，他只能依靠右侧一台发动机飞行。,现在已经很少人使用座机了,家里有一个座机,转眼之间使用座机好像是很久以前的事情了,A
以下哪句话中“义务”的意思(或用法)与其他句子不同。,放假时她常去参加义务劳动。,子女必须承担起赡养父母的义务。,他义务下乡给乡亲们理发，寒暑易节，刮风下雨，从不间断。,星期天，爸爸、妈妈带着我去参加义务劳动。,B
以下哪句话中“投机”的意思(或用法)与其他句子不同。,弟兄俩话不投机，只好各走各的路。,两个年轻人一见如故，谈得非常投机。,今天我们俩谈得非常投机，彼此情投意合，对许多问题看法都是一致的。,那家伙跟投机倒把分子勾勾搭搭。,D
以下哪句话中“烟火”的意思(或用法)与其他句子不同。,五颜六色的烟火把天空点缀得很美丽。,那烟囱冒起热腾腾的烟火。,寻常烟火最是抚慰人心。,人光靠吸风饮露是活不下去的，还是要吃点人间烟火食吧。,A
以下哪句话中“人流”的意思(或用法)与其他句子不同。,女孩子应该保护好自己不要去做人流,做人流的人不代表不是一个好人,人流对身体有害，我们尽量避免去做,今天车路上的人流量很多啊,D
以下哪句话中“西方”的意思(或用法)与其他句子不同。,夕阳落山不久，西方的天空还燃烧着一片橘红色的晚霞。,现实或不现实都被冲散，渐渐变淡，成为西方天空中的一缕残云。,西方红灼灼的霞光闪烁着，海水染成紫红。,敬颂往生咒，可以往生西方极乐世界。,D
以下哪句话中“偏食”的意思(或用法)与其他句子不同。,培养幼儿不偏食、不挑食的饮食卫生习惯。,小学生不要偏食，否则就可能营养不良。,古代的人们相信月偏食是一种坏的预兆。,我不偏食，甜的、酸的、咸的、辣的全喜欢。,C
以下哪句话中“低落”的意思(或用法)与其他句子不同。,低落的情绪要避免,不知道为什么最佳心情很低落,看到我的朋友心情低落我心情也不好,在紧急噪聒的水车声中，塘水一寸一寸地低落了。,D
以下哪句话中“拉扯”的意思(或用法)与其他句子不同。,爹妈好不容易才把我们兄弟姐妹拉扯大。,这两人在大庭广众之下拉扯，真是伤风败俗。,为了这两位新人的彩礼，两家人不断拉扯，最终才敲定。,对质演变成了拉扯头发。,A
以下哪句话中“虎口”的意思(或用法)与其他句子不同。,屏幕上反复播映的法国惊险喜剧片《虎口脱险》。,这项任务犹如虎口拔牙，你千万要小心。,一位民工在用力使用铁锄时碰上了硬物，震得虎口发麻。,杨六郎用了金蝉脱壳之计，才逃出虎口。,C
以下哪句话中“动手”的意思(或用法)与其他句子不同。,把泥再弄湿点再动手塑造。,他开始动手起草了辞呈。,乡里有些人就爱动手，胆小的又不敢还手。,玛格达马上动手收拾。,C
以下哪句话中“俘虏”的意思(或用法)与其他句子不同。,他不愿做俘虏，开枪自杀。,他们残杀了所有的俘虏。,他押着他的俘虏到帐房间去。,战争中俘虏了很多人去做劳动,D
以下哪句话中“上下”的意思(或用法)与其他句子不同。,文革期间全国上下天翻地覆。,时局长的话搞得全厂上下人心惶惶。,今年一亩地能有一千斤上下的收成。,春节时全国上下喜气洋洋。,C
以下哪句话中“自负”的意思(或用法)与其他句子不同。,生活中存在很多自负的人。,自负者看比尔总觉得自己比别人强。,成功有时会助长人骄傲自负的情绪。,一切开支均个人自负。,D
以下哪句话中“下手”的意思(或用法)与其他句子不同。,他们已经先下手了,这道数学题让我无从下手,我还没到，就已经下手了,班长给老师打下手,D
以下哪句话中“墨水”的意思(或用法)与其他句子不同。,钢笔是使用墨水的书写工具。,他把钢笔往墨水里蘸了蘸。,我肚里墨水不多，写起来有困难，希望你能助我一臂之力。,你的衬衫上有一个墨水斑。,C
以下哪句话中“杜鹃”的意思(或用法)与其他句子不同。,杜鹃是一种益鸟。,杜鹃也被人们称为布谷鸟。,天台山植物种类繁多，天台蜜桔久负盛名，六锦杜鹃遍布高山，盛产雾茶及多种中药材。,杜鹃有“春的使者”的美称。,C
以下哪句话中“自然”的意思(或用法)与其他句子不同。,你不用问太多，时间久了，自然会明白。,不用那样催他，他明白的时候自然会走！,在自然界，只有人类能够制造和使用劳动工具。,我的回答自然是对的啦！！！,C
以下哪句话中“大头”的意思(或用法)与其他句子不同。,看着看着，大头儿子非常着急，弟弟也跟着着急起来。,你只是一个平平常常，普普通通的大头老爸。,现在他们说，‘嘿，我现在掌舵了，生意都在我手下，所以你给我钱，我自己去投资拿大头’。,大头大头，下雨不愁，你有雨伞，我有大头。,C
以下哪句话中“机关”的意思(或用法)与其他句子不同。,机关工作人员要注意保守国家机密。,我军的机关枪正掩护着董存瑞冲到桥下面去。,他向政府机关告发了他。,政府机关把一个越境分子驱逐出境。,B
以下哪句话中“布局”的意思(或用法)与其他句子不同。,这个公园里的假山，布局新奇巧妙，真是巧夺天工呀！,宫?布局不依经，黑白相和子数停。,写文章有一条重要的原则，就是布局谨严，中心突出，不蔓不枝。,这篇作文文笔虽然不够优美，但布局安排还差强人意。,B
以下哪句话中“不爽”的意思(或用法)与其他句子不同。,她现在十分不爽。,对此他感到十分不爽。,他这一招屡试不爽。,他不爽地看着忏悔中的道士。,C
以下哪句话中“开山”的意思(或用法)与其他句子不同。,人类还通过给沼泽地排水、凿石开山、修建公路和铁路等方式，改变了地球的面貌。,据说，毛血旺的名称来源于其开山者姓毛，听说后来因为经营不善倒闭了。,李?是清初知名教育家、思想家，颜李学派开山者之一。,塔尔寺是我国著名的喇嘛寺院，是喇嘛教黄教开山者宗喀巴诞生地，亦是西北地区佛教活动的中心。,A
以下哪句话中“台风”的意思(或用法)与其他句子不同。,台风的破坏力极强,夏季是台风高发季节,台风的本质是热带风暴,梅兰芳的台风潇洒,D
